question,answer,choices.0.text,choices.0.correct,choices.1.text,choices.1.correct,choices.2.text,choices.2.correct,choices.3.text,choices.3.correct,images,category
"รถต่อไปนี้ได้รับการยกเว้นไม่ต้องเสียค่าธรรมเนียมเว้นแต่ค่าธรรมเนียมแผ่นป้ายทะเบียนรถ",รถของบุคคลในคณะผู้แทนทางการทูต ได้รับการยกเว้นไม่ต้องเสียค่าธรรมเนียมเว้นแต่ค่าธรรมเนียมแผ่นป้ายทะเบียนรถ,รถของบุคคลในคณะผู้แทนทางการทูต,true,รถของมูลนิธิร่วมกตัญญู,false,รถของวัด,false,รถของมูลนิธิสายใจไทย,false,[  ],กฎหมายว่าด้วยรถยนต์
"รถต่อไปนี้ได้รับการยกเว้นไม่ต้องเสียค่าธรรมเนียมเว้นแต่ค่าธรรมเนียมแผ่นป้ายทะเบียนรถ",รถดับเพลิงของ อบต. ได้รับการยกเว้นไม่ต้องเสียค่าธรรมเนียมเว้นแต่ค่าธรรมเนียมแผ่นป้ายทะเบียนรถ,รถดับเพลิงของ อบต.,true,รถตู้ส่วนบุคคล,false,รถตู้รับจ้าง,false,รถจักรยานยนต์ส่วนบุคคล,false,[  ],กฎหมายว่าด้วยรถยนต์
"ประสงค์จดทะเบียนรถต้องยื่นคำขอที่ใด",ประสงค์จดทะเบียนรถต้องยื่นคำขอต่อนายทะเบียนแห่งท้องที่ที่ตนมีภูมิลำเนา,ยื่นคำขอต่อนายทะเบียนที่สำนักงานขนส่งจังหวัดทุกแห่ง,false,ยื่นคำขอต่อนายทะเบียนแห่งท้องที่ที่ตนมีภูมิลำเนา,true,ยื่นคำขอต่อนายทะเบียนที่กรมการขนส่งทางบก,false,ยื่นคำขอต่อนายทะเบียนตามสถานที่ตั้งที่จำหน่ายรถนั้น ๆ,false,[  ],กฎหมายว่าด้วยรถยนต์
"รถที่จดทะเบียนแล้ว หากประสงค์จะเปลี่ยนสีรถต้องดำเนินการอย่างไร",รถที่จดทะเบียนแล้ว หากประสงค์จะเปลี่ยนสีรถต้องดำเนินการแจ้งนายทะเบียนภายใน 7 วัน,ดำเนินการเปลี่ยนสีได้ทันที,false,แจ้งนายทะเบียนภายใน 15 วัน,false,แจ้งนายทะเบียนภายใน 30 วัน,false,แจ้งนายทะเบียนภายใน 7 วัน,true,[  ],กฎหมายว่าด้วยรถยนต์
"หากประสงค์เปลี่ยนแปลงตัวถังรถต้องดำเนินการอย่างไร",หากประสงค์เปลี่ยนแปลงตัวถังรถต้องดำเนินการขออนุญาตนายทะเบียน ตามภูมิลำเนาที่จดทะเบียนรถ,เปลี่ยนแปลงแล้ว จึงจะมาดำเนินการที่สำนักงานขนส่ง,false,ขออนุญาตนายทะเบียน ตามภูมิลำเนาที่จดทะเบียนรถ,true,ต้องแจ้งเปลี่ยนแปลงภายใน 15 วัน,false,ไม่ต้องแจ้งการเปลี่ยนแปลงเพราะไม่ใช่สาระสำคัญของตัวรถ,false,[  ],กฎหมายว่าด้วยรถยนต์
"ผู้ตรวจการตาม พ.ร.บ. รถยนต์ คือใคร",ผู้ตรวจการตาม พ.ร.บ. รถยนต์ คือ เจ้าหน้าที่กรมการขนส่งทางบก ที่รัฐมนตรีว่าการกระทรวงคมนาคมแต่งตั้ง,เจ้าหน้าที่กรมการขนส่งทางบก ที่รัฐมนตรีว่าการกระทรวงคมนาคมแต่งตั้ง,true,เจ้าหน้าที่กรมการขนส่งทางบก,false,เจ้าหน้าที่ บริษัทขนส่ง จำกัด,false,เจ้าหน้าที่กรมการขนส่งทางบก และเจ้าหน้าที่ตำรวจ,false,[  ],กฎหมายว่าด้วยรถยนต์
"หากประสงค์จะย้ายรถ เจ้าของรถต้องแจ้งย้ายรถต่อนายทะเบียนภายในกี่วัน",หากประสงค์จะย้ายรถ เจ้าของรถต้องแจ้งย้ายรถต่อนายทะเบียนภายใน 15 วัน,30 วัน,false,7 วัน,false,15 วัน,true,60 วัน,false,[  ],กฎหมายว่าด้วยรถยนต์
"กรณีเจ้าของรถมีภารกิจไม่สามารถมาดำเนินแจ้งย้ายรถต่อนายทะเบียนภายในเวลาที่กฎหมายกำหนด ข้อใดถูกต้อง",กรณีเจ้าของรถมีภารกิจไม่สามารถมาดำเนินแจ้งย้ายรถต่อนายทะเบียนภายในเวลาที่กฎหมายกำหนด มีความผิด ต้องชำระค่าปรับแจ้งย้ายเกินกำหนด,มีความผิด ต้องชำระค่าปรับแจ้งย้ายเกินกำหนด,true,ไม่เสียค่าปรับ เนื่องจากจำเป็น,false,รถไม่สามารถแจ้งย้ายได้,false,ผิดทุกข้อ,false,[  ],กฎหมายว่าด้วยรถยนต์
"หากประสงค์จะโอนรถเจ้าของรถต้องแจ้งโอนรถต่อนายทะเบียนภายในกี่วัน",หากประสงค์จะโอนรถเจ้าของรถต้องแจ้งโอนรถต่อนายทะเบียนภายใน 15 วัน,60 วัน,false,25 วัน,false,30 วัน,false,15 วัน,true,[  ],กฎหมายว่าด้วยรถยนต์
"กรณีเจ้าของรถมีภารกิจไม่สามารถมาดำเนินแจ้งโอนรถต่อนายทะเบียนภายในเวลาที่กฎหมายกำหนด ข้อใดถูกต้อง",กรณีเจ้าของรถมีภารกิจไม่สามารถมาดำเนินแจ้งโอนรถต่อนายทะเบียนภายในเวลาที่กฎหมายกำหนด มีความผิด ต้องชำระค่าปรับโอนเกินกำหนด,ไม่เสียค่าปรับ เนื่องจากจำเป็น,false,มีความผิด ต้องชำระค่าปรับโอนเกินกำหนด,true,รถไม่สามารถแจ้งย้ายได้,false,ผิดทุกข้อ,false,[  ],กฎหมายว่าด้วยรถยนต์
"ข้อใดผิด",รถยนต์ส่วนบุคคล นำมาใช้รับจ้างไม่ได้,รถยนต์ส่วนบุคคล นำมาใช้รับจ้างได้,true,รถจักรยานยนต์ส่วนบุคคล ห้ามนำมาใช้ในการรับจ้างบรรทุกผู้โดยสาร,false,รถจักรยานยนต์สาธารณะ ใช้เพื่อการรับจ้างบรรทุกผู้โดยสาร,false,รถจักรยานยนต์สาธารณะ ใช้ในกิจการส่วนตัวได้,false,[  ],กฎหมายว่าด้วยรถยนต์
"นาย ก นำรถจักรยานยนต์สาธารณะของตนเองรับส่งภรรยาไปตลาดได้หรือไม่อย่างไร",นาย ก นำรถจักรยานยนต์สาธารณะของตนเองรับส่งภรรยาไปตลาดได้เพราะรถจักรยานยนต์สาธารณะสามารถนำมาใช้กิจการส่วนตัวของเจ้าของรถได้,ได้ เพราะภรรยานาย ก เป็นคนในครอบครัว,false,ได้ เพราะรถจักรยานยนต์สาธารณะสามารถนำมาใช้กิจการส่วนตัวของเจ้าของรถได้,true,ไม่ได้ เพราะรถจักรยานยนต์สาธารณะต้องนำมารับจ้างเท่านั้น,false,ไม่ได้ เพราะ รถจักรยานยนต์สาธารณะห้ามใช้ในกิจการส่วนบุคคลของเจ้าของรถ,false,[  ],กฎหมายว่าด้วยรถยนต์
"รถประเภทใดต่อไปนี้ใช้รับจ้างบรรทุกคนโดยสารได้",รถจักรยานยนต์สาธารณะใช้รับจ้างบรรทุกคนโดยสารได้,รถจักรยานยนต์สาธารณะ,true,รถจักรยานยนต์ส่วนบุคคล,false,รถยนต์ส่วนบุคคล,false,รถตู้ส่วนบุคคล,false,[  ],กฎหมายว่าด้วยรถยนต์
"รถยนต์ ไว้เพื่อขายหรือเพื่อซ่อม (ป้ายแดง) ตามกฎหมายว่าด้วยรถยนต์ ขับได้ในช่วงเวลาใด",รถยนต์ ไว้เพื่อขายหรือเพื่อซ่อม (ป้ายแดง) ตามกฎหมายว่าด้วยรถยนต์ ขับได้ระหว่างพระอาทิตย์ขึ้นจนถึงพระอาทิตย์ตก,ขับได้ตั้งแต่เวลา 08.00 น. ถึง 16.00 น.,false,ขับได้ตลอดเวลา,false,ห้ามขับเพราะยังไม่ได้เสียภาษี,false,ขับได้ระหว่างพระอาทิตย์ขึ้นจนถึงพระอาทิตย์ตก,true,[  ],กฎหมายว่าด้วยรถยนต์
"รถที่ไม่ได้เสียภาษีภายในเวลาที่กำหนดต้องชำระเงินเพิ่มร้อยละเท่าใด",รถที่ไม่ได้เสียภาษีภายในเวลาที่กำหนดต้องชำระเงินเพิ่มร้อยละ 1 บาทต่อเดือน," ร้อยละ 1 บาทต่อเดือน",true," ร้อยละ 1 บาทต่อปี",false," ร้อยละ 10 บาทต่อเดือน",false," ร้อยละ 10 บาทต่อปี",false,[  ],กฎหมายว่าด้วยรถยนต์
"รถที่ค้างชำระภาษีประจำปีติดต่อกันครบสามปี จะมีผลตามกฎหมายอย่างใด",รถที่ค้างชำระภาษีประจำปีติดต่อกันครบสามปี จะมีผลตามกฎหมาย คือ ทะเบียนระงับ,ทะเบียนระงับ,true,สามารถนำรถไปตรวจสภาพและต่อภาษีประจำปีได้,false,สามารถกระทำได้ตามข้อ 1  และ 2,false,สามารถนำรถไปแจ้งไม่ใช้ตลอดไปและจดทะเบียนใหม่ได้,false,[  ],กฎหมายว่าด้วยรถยนต์
"ข้อใดถูกต้อง",รถยนต์อายุการใช้งานครบ 7 ปี ประสงค์จะต่อภาษีประจำปีต้องนำรถไปตรวจที่สถานตรวจสภาพเอกชน,รถยนต์อายุการใช้งานครบ 5 ปี ประสงค์จะต่อภาษีประจำปีต้องนำรถไปตรวจที่สถานตรวจสภาพเอกชน,false,รถยนต์อายุการใช้งานครบ 7 ปี ประสงค์จะต่อภาษีประจำปีต้องนำรถไปตรวจที่สถานตรวจสภาพเอกชน,true,รถจักรยานยนต์อายุการใช้งานครบ 7 ปี ประสงค์จะต่อภาษีประจำปีต้องนำรถไปตรวจที่สถานตรวจสภาพเอกชน,false,รถยนต์อายุการใช้งานครบ 10 ปี ประสงค์จะต่อภาษีประจำปีต้องนำรถไปตรวจที่สถานตรวจสภาพเอกชน,false,[  ],กฎหมายว่าด้วยรถยนต์
"ข้อใดถูกต้อง",รถจักรยานยนต์อายุการใช้งานครบ 5 ปี ประสงค์จะต่อภาษีประจำปีต้องนำรถไปตรวจที่สถานตรวจสภาพเอกชน,รถจักรยานยนต์อายุการใช้งานครบ 5 ปี ประสงค์จะต่อภาษีประจำปีต้องนำรถไปตรวจที่สถานตรวจสภาพเอกชน,true,รถยนต์อายุการใช้งานครบ 5 ปี ประสงค์จะต่อภาษีประจำปีต้องนำรถไปตรวจที่สถานตรวจสภาพเอกชน,false,รถจักรยานยนต์อายุการใช้งานครบ 7 ปี ประสงค์จะต่อภาษีประจำปีต้องนำรถไปตรวจที่สถานตรวจสภาพเอกชน,false,รถยนต์อายุการใช้งานครบ 10 ปี ประสงค์จะต่อภาษีประจำปีต้องนำรถไปตรวจที่สถานตรวจสภาพเอกชน,false,[  ],กฎหมายว่าด้วยรถยนต์
"ข้อใดถูกต้องในขณะขับรถ",ในขณะขับรถ ผู้ขับรถต้องมีใบอนุญาตขับรถ และสำเนาภาพถ่ายใบคู่มือจดทะเบียนรถ,ผู้ขับรถต้องมีสำเนาใบอนุญาตขับรถ และใบคู่มือจดทะเบียนรถ,false,ผู้ขับรถต้องมีใบอนุญาตขับรถ และใบคู่มือจดทะเบียนรถ,false,ผู้ขับรถต้องมีใบอนุญาตขับรถ และสำเนาภาพถ่ายใบคู่มือจดทะเบียนรถ,true,ผู้ขับรถต้องมีสำเนาใบอนุญาตขับรถ และสำเนาใบคู่มือจดทะเบียนรถ,false,[  ],กฎหมายว่าด้วยรถยนต์
"ข้อใดถูกต้อง",ใบอนุญาตขับรถยนต์สาธารณะ ใช้แทน ใบอนุญาตขับรถยนต์ส่วนบุคคลได้,ใบอนุญาตขับรถยนต์สาธารณะ ใช้แทน ใบอนุญาตขับรถจักรยานยนต์ส่วนบุคคลได้,false,ใบอนุญาตขับรถยนต์สาธารณะ ใช้แทน ใบอนุญาตขับรถยนต์ส่วนบุคคลได้,true,ใบอนุญาตขับรถยนต์สาธารณะ ใช้แทน ใบอนุญาตขับรถยนต์สามล้อส่วนบุคคลได้,false,ใบอนุญาตขับรถยนต์สามล้อสาธารณะ ใช้แทน ใบอนุญาตขับรถจักรยานยนต์ส่วนบุคคลได้,false,[  ],กฎหมายว่าด้วยรถยนต์
"ข้อใดถูกต้อง",ใบอนุญาตขับรถจักรยานยนต์สาธารณะ ใช้แทน ใบอนุญาตขับรถจักรยานยนต์ส่วนบุคคลได้,ใบอนุญาตขับรถจักรยานยนต์สาธารณะ ใช้แทน ใบอนุญาตขับรถจักรยานยนต์ส่วนบุคคลได้,true,ใบอนุญาตขับรถยนต์สามล้อสาธารณะ ใช้แทน ใบอนุญาตขับรถจักรยานยนต์ส่วนบุคคลได้,false,ใบอนุญาตขับรถยนต์สาธารณะ ใช้แทน ใบอนุญาตขับรถจักรยานยนต์ส่วนบุคคลได้,false,ใบอนุญาตขับรถยนต์สาธารณะ ใช้แทน ใบอนุญาตขับรถยนต์สามล้อส่วนบุคคลได้,false,[  ],กฎหมายว่าด้วยรถยนต์
"ข้อใดถูกต้อง",ใบอนุญาตขับรถยนต์สามล้อสาธารณะ ใช้แทน ใบอนุญาตขับรถยนต์สามล้อส่วนบุคคลได้,ใบอนุญาตขับรถยนต์สามล้อสาธารณะ ใช้แทน ใบอนุญาตขับรถจักรยานยนต์ส่วนบุคคลได้,false,ใบอนุญาตขับรถยนต์สาธารณะ ใช้แทน ใบอนุญาตขับรถยนต์สามล้อส่วนบุคคลได้,false,ใบอนุญาตขับรถยนต์สาธารณะ ใช้แทน ใบอนุญาตขับรถจักรยานยนต์ส่วนบุคคลได้,false,ใบอนุญาตขับรถยนต์สามล้อสาธารณะ ใช้แทน ใบอนุญาตขับรถยนต์สามล้อส่วนบุคคลได้,true,[  ],กฎหมายว่าด้วยรถยนต์
"ใบอนุญาตขับรถส่วนบุคคลชั่วคราวมีอายุกี่ปี",ใบอนุญาตขับรถส่วนบุคคลชั่วคราวมีอายุ 1 ปี,1  ปี,true,2  ปี,false,3  ปี,false,5  ปี,false,[  ],กฎหมายว่าด้วยรถยนต์
"หากประสงค์จะเปลี่ยนประเภทใบอนุญาตขับรถยนต์ส่วนบุคคลชั่วคราวเป็นประเภทส่วนบุคคลชนิด 5 ปี ข้อใดถูกต้อง",หากประสงค์จะเปลี่ยนประเภทใบอนุญาตขับรถยนต์ส่วนบุคคลชั่วคราวเป็นประเภทส่วนบุคคลชนิด 5 ปี สามารถเปลี่ยนได้ล่วงหน้า 60 วัน,สามารถเปลี่ยนได้ล่วงหน้า 30 วัน,false,สามารถเปลี่ยนได้ล่วงหน้า 60 วัน,true,สามารถเปลี่ยนได้ล่วงหน้า 1 เดือน,false,สามารถเปลี่ยนได้ล่วงหน้า 3 เดือน,false,[  ],กฎหมายว่าด้วยรถยนต์
"ใบอนุญาตขับรถส่วนบุคคลชนิด 5 ปีต่ออายุล่วงหน้ากี่เดือน",ใบอนุญาตขับรถส่วนบุคคลชนิด 5 ปีต่ออายุล่วงหน้า 3 เดือน,1 เดือน,false,3 เดือน,true,4 เดือน,false,6 เดือน,false,[  ],กฎหมายว่าด้วยรถยนต์
"นาย ก เกิดที่จังหวัดเชียงใหม่ ประสงค์ขอรับใบอนุญาตขับรถยนต์ส่วนบุคคลชั่วคราว จะต้องไปดำเนินการที่ใด",นาย ก เกิดที่จังหวัดเชียงใหม่ ประสงค์ขอรับใบอนุญาตขับรถยนต์ส่วนบุคคลชั่วคราว จะต้องไปดำเนินการที่สำนักงานขนส่งจังหวัด และสำนักงานขนส่งจังหวัดสาขา ทุกแห่ง,สำนักงานขนส่งจังหวัด และสำนักงานขนส่งจังหวัดสาขา ทุกแห่ง,true,สำนักงานขนส่งจังหวัดเชียงใหม่ ยกเว้น กรุงเทพมมหานคร,false,สำนักงานขนส่งจังหวัดเชียงใหม่ ยกเว้น สำนักงานขนส่งจังหวัดยะลา สาขาอำเภอเบตง,false,ผิดทุกข้อ,false,[  ],กฎหมายว่าด้วยรถยนต์
"ผู้ขอรับใบอนุญาตขับรถยนต์ชั่วราวต้องมีอายุกี่ปี",ผู้ขอรับใบอนุญาตขับรถยนต์ชั่วราวต้องมีอายุไม่ต่ำกว่า 18 ปี บริบูรณ์,ไม่ต่ำกว่า 15 ปี บริบูรณ์,false,ไม่ต่ำกว่า 16 ปี บริบูรณ์,false,ไม่ต่ำกว่า 17 ปี บริบูรณ์,false,ไม่ต่ำกว่า 18 ปี บริบูรณ์,true,[  ],กฎหมายว่าด้วยรถยนต์
