question,answer,choices.0.text,choices.0.correct,choices.1.text,choices.1.correct,choices.2.text,choices.2.correct,choices.3.text,choices.3.correct,images.0,category
"จากสถานการณ์ดังรูป หากต้องการจะเคลื่อนที่ต่อไป ผู้ขับขี่ควรปฏิบัติอย่างไรเป็นลำดับแรก",จากสถานการณ์ดังรูป หากต้องการจะเคลื่อนที่ต่อไป ผู้ขับขี่ควรตรวจสอบความปลอดภัยทางด้านขวา,เปิดสัญญาณไฟ,false,ตรวจสอบความปลอดภัยทางด้านขวา,true,บีบแตรให้สัญญาณ,false,ลดกระจกแล้วโบกมือขอทาง,false,1.8.32.jpg,เทคนิคการขับรถอย่างปลอดภัย
"เมื่อต้องขับรถเข้าใกล้ทางรถไฟที่ไม่มีแผงกั้น ข้อใดต่อไปนี้กล่าวถูกต้อง",เมื่อต้องขับรถเข้าใกล้ทางรถไฟที่ไม่มีแผงกั้น ต้องชะลอรถและควรเตรียมพร้อมที่จะหยุดรถตลอดเวลา,ชะลอรถและควรเตรียมพร้อมที่จะหยุดรถตลอดเวลา,true,เพิ่มความเร็วเพื่อให้ผ่านไปได้เร็ว,false,บีบแตรเตือนเพื่อความปลอดภัย,false,เปิดกระจกเพื่อฟังเสียงสัญญาณเตือนรถไฟ,false,1.8.33.jpg,เทคนิคการขับรถอย่างปลอดภัย
"เมื่อขับผ่านทางที่มีป้ายเตือนว่า “ระวังทางข้างหน้าหินหล่นทับเส้นทางบ่อย” หรือป้ายเตือนดังในรูป ท่านควรปฏิบัติอย่างไร",เมื่อขับผ่านทางที่มีป้ายเตือนว่า “ระวังทางข้างหน้าหินหล่นทับเส้นทางบ่อย” หรือป้ายเตือนดังในรูป ท่านควรชะลอความเร็วลง ขับขี่ด้วยความระมัดระวังมากขึ้น,ชะลอความเร็วลง ขับขี่ด้วยความระมัดระวังมากขึ้น,true,รีบเร่งความเร็วเพื่อผ่านไปอย่างรวดเร็ว,false,ไม่ต้องทำอะไร เพราะโอกาสที่จะเกิดยาก,false,หลีกเลี่ยงไปใช้เส้นทางอื่น,false,1.8.34.jpg,เทคนิคการขับรถอย่างปลอดภัย
"เมื่อพบว่าไฟไหม้เครื่องยนต์ขณะขับรถ ผู้ขับรถควรปฏิบัติอย่างไร",เมื่อพบว่าไฟไหม้เครื่องยนต์ขณะขับรถ ผู้ขับรถควรตั้งสติ ค่อยๆ ขับรถจอดข้างทาง,ขับรถลงแม่น้ำข้างทาง,false,จอดและสละรถทันที,false,ตั้งสติ ค่อยๆ ขับรถจอดข้างทาง,true,แจ้งกู้ภัยทางหลวง,false,,เทคนิคการขับรถอย่างปลอดภัย
"สิ่งใดต่อไปนี้มีผลทำให้รถเปลืองน้ำมัน",การบรรทุกน้ำหนักเกินกว่าที่กำหนด ทำให้รถเปลืองน้ำมัน,ดอกยางสึกหรอ,false,ขับรถด้วยความเร็วคงที่,false,ระยะการปรับเบรกปกติ,false,บรรทุกน้ำหนักเกินกว่าที่กำหนด,true,,เทคนิคการขับรถอย่างปลอดภัย
"ปัจจัยใดต่อไปนี้มีผลต่อการเกิดสถานการณ์อันตรายมากที่สุด",ความไม่พร้อมของคนขับมีผลต่อการเกิดสถานการณ์อันตรายมากที่สุด,ความไม่พร้อมของคนขับ,true,ลักษณะทางภูมิศาสตร์,false,การเคลื่อนที่ของรถ หรือคนเดินเท้า,false,สภาพผิวจราจร,false,,เทคนิคการขับรถอย่างปลอดภัย
"ข้อใดกล่าวถูกต้องเกี่ยวกับการขับรถอย่างปลอดภัย",การเว้นระยะห่างจากรถคันหน้าในขณะฝนตกควรมากกว่าการขับรถในสภาวะปกติ เป็นการขับรถอย่างปลอดภัย,หากง่วงนอนมากควรขับรถด้วยความเร็วสูง เพื่อให้ตื่นตัว,false,การเว้นระยะห่างจากรถคันหน้าในขณะฝนตกควรมากกว่าการขับรถในสภาวะปกติ,true,ไม่จำเป็นต้องตรวจสภาพรถก่อนออกเดินทาง,false,ควรขับรถด้วยความเร็ว 120 กิโลเมตรต่อชั่วโมง เพื่อถึงที่หมายเร็วขึ้น,false,,เทคนิคการขับรถอย่างปลอดภัย
"จากรูป หากท่านต้องการแซงรถข้างหน้าแล้วกลับช่องทางเดินรถด้านซ้าย ท่านจะต้องให้สัญญาณไฟอย่างไร",จากรูป หากท่านต้องการแซงรถข้างหน้าแล้วกลับช่องทางเดินรถด้านซ้าย ท่านจะต้องตรวจสอบความปลอดภัยแล้วเปิดสัญญาณไฟเลี้ยวขวาก่อนแซง,ตรวจสอบความปลอดภัยแล้วเปิดสัญญาณไฟเลี้ยวขวาก่อนแซง,true,เปิดสัญญาณไฟเลี้ยวซ้ายขณะแซง,false,เปิดสัญญาณไฟเลี้ยวขวาก่อนและตามด้วยสัญญาณไฟเลี้ยวซ้ายขณะแซง,false,ไม่จำเป็นต้องเปิดสัญญาณไฟหากรถคันหน้าขับด้วยความเร็วต่ำ,false,1.8.39.jpg,เทคนิคการขับรถอย่างปลอดภัย
"สถานการณ์ใดใช้ไฟฉุกเฉินได้อย่างเหมาะสม",เปิดไฟฉุกเฉินเมื่อรถจอดเสียอยู่บริเวณไหล่ทาง เป็นการใช้ไฟฉุกเฉินได้อย่างเหมาะสม,เปิดไฟฉุกเฉินในขณะที่หมอกลงจัด,false,เปิดไฟฉุกเฉินเมื่อกำลังจะเลี้ยวซ้ายบริเวณทางแยกที่ไม่มีสัญญาณไฟจราจร,false,เปิดไฟฉุกเฉินเพื่อให้ผู้ขับขี่ท่านอื่นทราบว่าตนจะวิ่งตรงไป,false,เปิดไฟฉุกเฉินเมื่อรถจอดเสียอยู่บริเวณไหล่ทาง,true,,เทคนิคการขับรถอย่างปลอดภัย
"รถที่ขับมาด้วยความเร็วสูงแล้วเหยียบเบรกกะทันหัน (รถที่ไม่มีระบบเบรก ABS) จะมีผลอย่างไร",รถที่ขับมาด้วยความเร็วสูงแล้วเหยียบเบรกกะทันหัน (รถที่ไม่มีระบบเบรก ABS) จะมีผลทำให้ล้อจะล็อกและรถอาจจะหมุน,จะหยุดรถได้ตามระยะที่กำหนด,false,รถจะค่อยๆ ชะลอความเร็วลง,false,ล้อจะล็อกและรถอาจจะหมุน,true,ล้อจะล็อกและรถจะหยุดทันที,false,,เทคนิคการขับรถอย่างปลอดภัย
"การหยุดรถอย่างกะทันหัน (รถที่ไม่มีระบบเบรก ABS) ควรปฏิบัติอย่างไร",การหยุดรถอย่างกะทันหัน (รถที่ไม่มีระบบเบรก ABS) ควรเหยียบเบรกสลับกับปล่อยเบรกเป็นจังหวะ,เหยียบเบรกสลับกับปล่อยเบรกเป็นจังหวะ,true,เหยียบเบรกแรงๆ,false,เหยียบเบรกเท้าสลับกับดึงเบรกมือ,false,เหยียบเบรกเท้าและดึงเบรกมือพร้อมกัน,false,,เทคนิคการขับรถอย่างปลอดภัย
"ข้อใดปฏิบัติไม่ถูกต้องในการเบรกฉุกเฉิน",ใช้เบรกมือช่วยเป็นการหยุดรถที่ไม่ถูกต้องในการเบรกฉุกเฉิน,หักพวงมาลัยหลบเมื่อจำเป็นต้องหลบการปะทะด้านหน้า,false,มือทั้งสองข้างต้องจับอยู่ที่พวงมาลัย,false,ใช้เบรกมือช่วย,true,หลีกเลี่ยงการเหยียบกระแทกเบรกสำหรับเบรกที่ไม่ใช่ระบบเบรก ABS,false,,เทคนิคการขับรถอย่างปลอดภัย
"การจอดรถลักษณะใดที่อาจก่อให้เกิดอุบัติเหตุ",การจอดรถซ้อนคัน เป็นการจอดรถลักษณะที่อาจก่อให้เกิดอุบัติเหตุ,จอดรถซ้อนคัน,true,จอดรถชิดขอบทางด้านซ้าย,false,จอดรถในลานจอดรถ,false,จอดรถภายในอาคารจอดรถ,false,,เทคนิคการขับรถอย่างปลอดภัย
"รูปใดต่อไปนี้ ห้ามจอด",ห้ามจอดตามรูป 2. และรูป 3.,รูป 1. และรูป 2.,false,รูป 2. และรูป 3.,true,รูป 1. และรูป 3.,false,ทั้งรูป 1. 2. และ 3.,false,1.8.45.1.jpg,เทคนิคการขับรถอย่างปลอดภัย
"หากท่านจอดรถชิดขอบทางทางด้านซ้ายอยู่ และต้องการที่จะเคลื่อนตัวออก ท่านควรปฏิบัติอย่างไร",หากท่านจอดรถชิดขอบทางทางด้านซ้ายอยู่ และต้องการที่จะเคลื่อนตัวออก ท่านควรมองดูรถที่ตามมาผ่านกระจกมองข้างและกระจกมองหลัง จากนั้นเปิดสัญญาณไฟเลี้ยวขวา,มองดูรถที่ตามมาผ่านกระจกมองข้างและกระจกมองหลัง จากนั้นเปิดสัญญาณไฟเลี้ยวขวา,true,เปิดสัญญาณไฟเพื่อเตือนให้รถคันที่ตามมาชะลอความเร็วลง,false,ไม่จำเป็นต้องหันมองดูรถที่จอดอยู่ข้างหน้า มองแค่รถที่ตามมาก็พอ,false,ให้สัญญาณมือเพื่อขอทาง,false,,เทคนิคการขับรถอย่างปลอดภัย
"เมื่อฝนเริ่มตกหนักในขณะที่ท่านขับรถอยู่ในเขตที่จำกัดความเร็วไม่เกิน 60 กิโลเมตรต่อชั่วโมง ท่านควรปฏิบัติอย่างไร",เมื่อฝนเริ่มตกหนักในขณะที่ท่านขับรถอยู่ในเขตที่จำกัดความเร็วไม่เกิน 60 กิโลเมตรต่อชั่วโมง ท่านควรชะลอความเร็วลง,ขับด้วยความเร็วเท่าเดิม,false,ชะลอความเร็วลง,true,ขับรถเข้าข้างทางและรอจนกว่าฝนจะหยุดตก,false,เร่งความเร็ว,false,,เทคนิคการขับรถอย่างปลอดภัย
"สาเหตุใดต่อไปนี้เป็นสาเหตุหลักที่ทำให้เกิดการชนท้าย",การขับรถชิดคันหน้ามากเกินไป สาเหตุใดต่อไปนี้เป็นสาเหตุหลักที่ทำให้เกิดการชนท้าย,คนข้ามถนนตัดหน้า,false,สัญญาณไฟจราจรเปลี่ยนแปลงโดยฉับพลัน,false,ขับรถชิดคันหน้ามากเกินไป,true,การหยุดรถทุกๆ แยก,false,,เทคนิคการขับรถอย่างปลอดภัย
"การขับรถทิ้งระยะห่างจากรถคันหน้ามากเกินไป จะเกิดผลเสียอย่างไรกับสภาพการจราจร",การขับรถทิ้งระยะห่างจากรถคันหน้ามากเกินไป จะเกิดปัญหาการจราจรติดขัด,การจราจรคล่องตัวมากขึ้น,false,จะขับรถด้วยความปลอดภัยมากขึ้น,false,ลดอุบัติเหตุ,false,เกิดปัญหาการจราจรติดขัด,true,,เทคนิคการขับรถอย่างปลอดภัย
"เพื่อเป็นการป้องกันอุบัติเหตุ ผู้ขับขี่ต้องทิ้งระยะห่างจากรถคันหน้าเป็นระยะเท่าใด",เพื่อเป็นการป้องกันอุบัติเหตุ ผู้ขับขี่ต้องทิ้งระยะห่างให้เหมาะสมกับความเร็วของรถ,ระยะห่างที่เหมาะสมกับความเร็วของรถ,true,2 เมตร,false,3 เมตร,false,ไม่น้อยกว่า 4 เมตร,false,,เทคนิคการขับรถอย่างปลอดภัย
"ข้อใดต่อไปนี้ไม่ถูกต้องในการขับขี่",เมื่อรถคันหลังขับตามมาในระยะกระชั้นชิด ควรเพิ่มความเร็ว เป็นการขับขี่ที่ไม่ถูกต้อง,เมื่อรถคันหลังขับตามมาในระยะกระชั้นชิด ควรเพิ่มความเร็ว,true,น้ำหนักและความเร็วของตัวรถมีผลต่อระยะทางในการหยุดรถ,false,ระยะปลอดภัยของรถใหญ่จะต้องมีมากกว่าระยะปลอดภัยของรถยนต์,false,เมื่อระยะห่างกับรถคันหน้าน้อยเกินไป ควรลดความเร็ว,false,,เทคนิคการขับรถอย่างปลอดภัย
"การเปลี่ยนช่องทางจราจร ควรปฏิบัติอย่างไร",การเปลี่ยนช่องทางจราจร ควรมองกระจกข้าง ให้สัญญาณแล้วเปลี่ยนช่องจราจรเมื่อเห็นว่าปลอดภัย,เปลี่ยนช่องจราจรเมื่อใดก็ได้,false,มองกระจกข้าง ให้สัญญาณแล้วเปลี่ยนช่องจราจรเมื่อเห็นว่าปลอดภัย,true,เปลี่ยนช่องจราจรโดยเร็วเพื่อหลบรถคันอื่น,false,ให้สัญญาณมือและสัญญาณไฟแล้วเปลี่ยนช่องจราจรได้เลย,false,,เทคนิคการขับรถอย่างปลอดภัย
"หากท่านเห็นรถบรรทุกที่อยู่ข้างหน้าเปิดไฟเลี้ยวซ้ายแต่กำลังเคลื่อนไปทางขวา ท่านควรปฏิบัติอย่างไร",หากท่านเห็นรถบรรทุกที่อยู่ข้างหน้าเปิดไฟเลี้ยวซ้ายแต่กำลังเคลื่อนไปทางขวา ท่านควรรักษาระยะห่างไว้และรอให้รถใหญ่เคลื่อนไปในทิศทางที่แน่นอน,รักษาระยะห่างไว้และรอให้รถใหญ่เคลื่อนไปในทิศทางที่แน่นอน,true,ขับเข้าไปใกล้ๆ เพื่อเตรียมแซง,false,ให้เข้าใจว่าผู้ขับขี่รถใหญ่นั้นเปิดสัญญาณไฟผิด,false,เตรียมแซงเมื่อรถใหญ่เริ่มชะลอความเร็ว,false,1.8.53.1.jpg,เทคนิคการขับรถอย่างปลอดภัย
"จากรูป รถคันสีน้ำเงิน หรือรถคันสีเขียว มีสิทธิที่จะได้ไปก่อน",จากรูป รถคันสีเขียว มีสิทธิที่จะได้ไปก่อน,รถคันสีน้ำเงิน,false,รถคันสีเขียว,true,รถคันไหนไปก่อนก็ได้,false,มีสิทธิที่จะไปพร้อมๆ กัน,false,1.8.54.1.jpg,เทคนิคการขับรถอย่างปลอดภัย
"กรณีที่ท่านเห็นรถคันอื่นให้สัญญาณเพื่อเลี้ยวรถหรือเปลี่ยนช่องทางการเดินรถ ท่านต้องปฏิบัติอย่างไร",กรณีที่ท่านเห็นรถคันอื่นให้สัญญาณเพื่อเลี้ยวรถหรือเปลี่ยนช่องทางการเดินรถ ท่านต้องชะลอความเร็วและให้ทาง,ชะลอความเร็วและให้ทาง,true,เร่งความเร็วเพื่อจะไปก่อน,false,หยุดรถ,false,จอดรถ,false,,เทคนิคการขับรถอย่างปลอดภัย
"จากรูป รถคันใดจะต้องให้ทาง",จากรูป รถคันสีขาวจะต้องให้ทาง,รถคันสีขาว,true,รถคันสีแดง,false,รถที่มีความเร็วสูงกว่า,false,รถที่มีความเร็วต่ำกว่า,false,1.8.56.1.jpg,เทคนิคการขับรถอย่างปลอดภัย
"รูปใดแสดงการกลับรถที่ถูกต้อง",รูป 3.แสดงการกลับรถที่ถูกต้อง,รูป 1.,false,รูป 2.,false,รูป 3.,true,รูป 1. และ รูป 3.,false,1.8.57.1.jpg,เทคนิคการขับรถอย่างปลอดภัย
"ข้อใดต่อไปนี้เป็นการปฏิบัติที่ไม่ถูกต้อง",การแซงขณะที่รถข้างหลังกำลังจะแซงรถของท่านเป็นการปฏิบัติที่ไม่ถูกต้อง,ไม่แซงหากรถคันหน้ากำลังแซงอยู่,false,แซงขณะที่รถข้างหลังกำลังจะแซงรถของท่าน,true,ไม่แซงหากมีรถวิ่งสวนมาในระยะใกล้,false,แซงได้หากรถข้างหน้าของท่านเปิดไฟเลี้ยวซ้ายและชะลอความเร็วลง,false,,เทคนิคการขับรถอย่างปลอดภัย
"จากรูป หากรถที่ท่านกำลังจะแซงเปิดสัญญาณไฟเลี้ยวขวา ผู้ขับขี่ควรปฏิบัติอย่างไร",จากรูป หากรถที่ท่านกำลังจะแซงเปิดสัญญาณไฟเลี้ยวขวา ผู้ขับขี่ควรชะลอความเร็วและรอจนกว่ารถคันหน้าเลี้ยวผ่านไป,ชะลอความเร็วและรอจนกว่ารถคันหน้าเลี้ยวผ่านไป,true,เพิ่มความเร็วของรถและแซงผ่านไป,false,ให้สัญญาณไฟสูงเพื่อบอกให้รู้ว่าจะแซงผ่านไปก่อน,false,ให้สัญญาณแตรเพื่อบอกให้รู้ว่าจะแซงผ่านไปก่อน,false,1.8.59.jpg,เทคนิคการขับรถอย่างปลอดภัย
